{
  "oracle_version": 1,
  "title_id": "sample_title",
  "timing_window": {
    "max_halfcycles": 700000,
    "min_done_hits": 1
  },
  "iec_behavior": {
    "require_no_host_fallback": true,
    "max_retry_count": 0
  },
  "error_semantics": {
    "expected_dos_codes": [0, 20, 21, 22, 23, 27],
    "max_unexpected_error_rows": 0
  },
  "loader_profile": {
    "parity_min_runs": 480,
    "parity_max_mismatch_rows": 0
  },
  "weak_sync_profile": {
    "min_weak_events": 25,
    "min_sync_recovery_events": 15
  }
}
